{
  "schemaVersion": "agentcert.assurance_scope.v0.1",
  "agent": {
    "id": "my-browser-agent",
    "version": "1.0.0",
    "artifactSha256": "aaaaaaaaaaaaaaaaaaaaaaaaaaaaaaaaaaaaaaaaaaaaaaaaaaaaaaaaaaaaaaaa"
  },
  "model": {
    "provider": "openai",
    "name": "gpt-4.1-mini",
    "version": "pinned-deployment-version"
  },
  "prompt": {
    "sha256": "bbbbbbbbbbbbbbbbbbbbbbbbbbbbbbbbbbbbbbbbbbbbbbbbbbbbbbbbbbbbbbbb"
  },
  "tools": {
    "manifestSha256": "cccccccccccccccccccccccccccccccccccccccccccccccccccccccccccccccc"
  },
  "policy": {
    "id": "agentcert.browser.v0.1",
    "version": "0.1.0",
    "sha256": "dddddddddddddddddddddddddddddddddddddddddddddddddddddddddddddddd"
  },
  "scenarioSuite": {
    "id": "tripwire-browser",
    "version": "2026.07",
    "sha256": "eeeeeeeeeeeeeeeeeeeeeeeeeeeeeeeeeeeeeeeeeeeeeeeeeeeeeeeeeeeeeeee"
  }
}
